channel_id,platform,region,objective,cost_model,unit,currency,typical_value,low_value,high_value,notes,source_url,source_date
google_search_cpc_nl_est,Google Ads,NL,Search Clicks,cpc,per_click,USD,4.66,,,Global 2024 avg CPC; use NL multiplier if you adopt a country factor.,https://www.wordstream.com/blog/2024-google-ads-benchmarks,2025-05-20
linkedin_clicks_cpc_nl,LinkedIn Ads,NL,Website Clicks,cpc,per_click,EUR,5.00,2.53,7.46,Netherlands CPC benchmark range for website clicks.,https://merkelijkheid.nl/en/linkedin-advertising/linkedin-benchmark-2/,2024-06-01
linkedin_brand_cpc_nl,LinkedIn Ads,NL,Brand Awareness,cpc,per_click,EUR,4.00,2.12,9.60,Netherlands CPC benchmark range for brand goals.,https://merkelijkheid.nl/en/linkedin-advertising/linkedin-benchmark-2/,2024-06-01
meta_cpc_nl_est,Meta (Facebook/Instagram),NL,Traffic Clicks,cpc,per_click,USD,2.40,,,Country-level predicted CPC; use as order-of-magnitude.,https://enhencer.com/blog/facebook-cpc-by-country-2024,2024-01-01
facebook_cpc_global_bench,Meta (Facebook),Global,Leads/Traffic,cpc,per_click,USD,1.88,,,Global 2024 benchmark CPC for Leads objective.,https://www.wordstream.com/blog/facebook-ads-benchmarks-2024,2025-09-08
adsense_display_cpc_nl_proxy,Google AdSense (Display),NL,Display Clicks (proxy),cpc,per_click,USD,0.26,,,Publisher-side CPC for NL; use as lower-bound display click cost.,https://worldpopulationreview.com/country-rankings/adsense-cpc-rates-by-country,2024-01-01
youtube_cpm_eu,YouTube Ads,EU,Video Impressions,cpm,per_1000_impressions,EUR,2.50,1.00,8.00,Pan-EU CPM distribution (creator-side data but widely used as planning proxy).,https://isthischannelmonetized.com/data/youtube-cpm/,2025-03-12
tiktok_cpm_global,TikTok Ads,Global,Video Impressions,cpm,per_1000_impressions,USD,3.21,,,E-commerce benchmark CPM.,https://lebesgue.io/tiktok-ads/tiktok-ads-benchmarks-for-ctr-cr-and-cpm,2025-06-01
tiktok_cpc_global,TikTok Ads,Global,Traffic Clicks,cpc,per_click,USD,0.75,0.25,4.00,Global CPC range from industry roundup.,https://www.businessofapps.com/marketplace/tiktok/research/tiktok-ads-cost/,2025-02-27
reddit_cpm_eu_est,Reddit Ads,EU,Impressions,cpm,per_1000_impressions,EUR,5.00,2.50,12.00,EU planning range (evidence base is mixed; validate per vertical).,https://convertbomb.com/blog/reddit-ads-how-to-advertise-on-reddit-and-get-results,2025-03-29
native_outbrain_cpc_global,Outbrain (Native),Global,Content/Traffic,cpc,per_click,USD,0.30,0.10,0.50,Native ads CPC typical range.,https://www.nativeadvertisinginstitute.com/blog/how-much-do-native-ads-really-cost,2025-04-04
native_programmatic_cpm_global,Programmatic Native,Global,Impressions,cpm,per_1000_impressions,USD,5.00,3.00,7.00,Native networks CPM range.,https://www.nativeadvertisinginstitute.com/blog/how-much-do-native-ads-really-cost,2025-04-04
microsoft_ads_cpc_global_est,Microsoft Ads (Bing),Global,Search Clicks,cpc,per_click,USD,2.69,,,Use Google global CPC as proxy if no country metric is available.,https://www.storegrowers.com/google-ads-benchmarks/,2025-06-13
google_display_cpc_global,Google Display Network,Global,Display Clicks,cpc,per_click,USD,0.63,,,Global avg CPC for display.,https://www.storegrowers.com/google-ads-benchmarks/,2025-06-13
facebook_cpm_eu_forum,Meta (Facebook/Instagram),EU,Impressions,cpm,per_1000_impressions,EUR,18.50,,,Anecdotal CPM from EU buyer thread; treat as upper-range datapoint.,https://www.reddit.com/r/FacebookAds/comments/1dm4xfe/what_is_the_average_cpm_in_europe/,2024-06-14
taboola_outbrain_cpc_user_test,Taboola/Outbrain,Global,Traffic Clicks,cpc,per_click,USD,0.20,,,User-reported CPC from A/B test (directional only).,https://www.reddit.com/r/PPC/comments/1k60u3g/my_taboola_vs_outbrain_test_020_cpc_38/,2025-04-30
